  0.000000 192.168.1.100 -> 192.168.1.1  DNS 79 Standard query A notify3.dropbox.com
  0.763755 192.168.1.100 -> 192.168.1.1  TCP 74 59570 > http [SYN] Seq=0 Win=14600 Len=0 MSS=1460 SACK_PERM=1 TSval=2996825 TSecr=0 WS=16
  0.766004  192.168.1.1 -> 192.168.1.100 TCP 74 http > 59570 [SYN, ACK] Seq=0 Ack=1 Win=5792 Len=0 MSS=1460 SACK_PERM=1 TSval=185172 TSecr=2996825 WS=2
  0.766155 192.168.1.100 -> 192.168.1.1  TCP 66 59570 > http [ACK] Seq=1 Ack=1 Win=14608 Len=0 TSval=2996825 TSecr=185172
  0.767103 192.168.1.100 -> 192.168.1.1  HTTP 535 GET /en/conn_index.asp HTTP/1.1 
  0.778003  192.168.1.1 -> 192.168.1.100 TCP 66 http > 59570 [ACK] Seq=1 Ack=470 Win=6864 Len=0 TSval=185173 TSecr=2996826
  0.818274  192.168.1.1 -> 192.168.1.100 TCP 525 [TCP segment of a reassembled PDU]
  0.818403 192.168.1.100 -> 192.168.1.1  TCP 66 59570 > http [ACK] Seq=470 Ack=460 Win=15680 Len=0 TSval=2996838 TSecr=185177
  0.838211  192.168.1.1 -> 192.168.1.100 TCP 84 [TCP segment of a reassembled PDU]
  0.838309 192.168.1.100 -> 192.168.1.1  TCP 66 59570 > http [ACK] Seq=470 Ack=478 Win=15680 Len=0 TSval=2996843 TSecr=185179
  0.840428  192.168.1.1 -> 192.168.1.100 TCP 142 [TCP segment of a reassembled PDU]
  0.840528 192.168.1.100 -> 192.168.1.1  TCP 66 59570 > http [ACK] Seq=470 Ack=554 Win=15680 Len=0 TSval=2996844 TSecr=185180
  0.849532 192.168.1.100 -> 192.168.1.1  TCP 74 59571 > http [SYN] Seq=0 Win=14600 Len=0 MSS=1460 SACK_PERM=1 TSval=2996846 TSecr=0 WS=16
  0.850488  192.168.1.1 -> 192.168.1.100 TCP 97 [TCP segment of a reassembled PDU]
  0.850582 192.168.1.100 -> 192.168.1.1  TCP 66 59570 > http [ACK] Seq=470 Ack=585 Win=15680 Len=0 TSval=2996846 TSecr=185180
  0.852012  192.168.1.1 -> 192.168.1.100 TCP 74 http > 59571 [SYN, ACK] Seq=0 Ack=1 Win=5792 Len=0 MSS=1460 SACK_PERM=1 TSval=185181 TSecr=2996846 WS=2
  0.852135 192.168.1.100 -> 192.168.1.1  TCP 66 59571 > http [ACK] Seq=1 Ack=1 Win=14608 Len=0 TSval=2996847 TSecr=185181
  0.853206 192.168.1.100 -> 192.168.1.1  HTTP 474 GET /js/help_index.js HTTP/1.1 
  0.857838  192.168.1.1 -> 192.168.1.100 TCP 66 http > 59571 [ACK] Seq=1 Ack=409 Win=6864 Len=0 TSval=185181 TSecr=2996847
  0.866504  192.168.1.1 -> 192.168.1.100 TCP 175 [TCP segment of a reassembled PDU]
  0.866640 192.168.1.100 -> 192.168.1.1  TCP 66 59570 > http [ACK] Seq=470 Ack=694 Win=15680 Len=0 TSval=2996850 TSecr=185182
  0.889410  192.168.1.1 -> 192.168.1.100 TCP 294 [TCP segment of a reassembled PDU]
  0.889520 192.168.1.100 -> 192.168.1.1  TCP 66 59570 > http [ACK] Seq=470 Ack=922 Win=16752 Len=0 TSval=2996856 TSecr=185184
  0.905420  192.168.1.1 -> 192.168.1.100 TCP 86 [TCP segment of a reassembled PDU]
  0.905517 192.168.1.100 -> 192.168.1.1  TCP 66 59570 > http [ACK] Seq=470 Ack=942 Win=16752 Len=0 TSval=2996860 TSecr=185186
  0.907602  192.168.1.1 -> 192.168.1.100 TCP 91 [TCP segment of a reassembled PDU]
  0.907693 192.168.1.100 -> 192.168.1.1  TCP 66 59570 > http [ACK] Seq=470 Ack=967 Win=16752 Len=0 TSval=2996861 TSecr=185186
  0.925269  192.168.1.1 -> 192.168.1.100 TCP 155 [TCP segment of a reassembled PDU]
  0.925363 192.168.1.100 -> 192.168.1.1  TCP 66 59570 > http [ACK] Seq=470 Ack=1056 Win=16752 Len=0 TSval=2996865 TSecr=185188
  0.931976 192.168.1.100 -> 199.47.216.172 TCP 66 49943 > https [RST, ACK] Seq=1 Ack=1 Win=1976 Len=0 TSval=2996867 TSecr=2515094755
  0.938709 192.168.1.100 -> 192.168.1.1  DNS 81 Standard query A client-lb.dropbox.com
  0.948780  192.168.1.1 -> 192.168.1.100 TCP 238 [TCP segment of a reassembled PDU]
  0.948922 192.168.1.100 -> 192.168.1.1  TCP 66 59570 > http [ACK] Seq=470 Ack=1228 Win=17824 Len=0 TSval=2996871 TSecr=185190
  0.978231  192.168.1.1 -> 192.168.1.100 TCP 125 [TCP segment of a reassembled PDU]
  0.978331 192.168.1.100 -> 192.168.1.1  TCP 66 59570 > http [ACK] Seq=470 Ack=1287 Win=17824 Len=0 TSval=2996878 TSecr=185192
  1.099960  192.168.1.1 -> 192.168.1.100 TCP 182 [TCP segment of a reassembled PDU]
  1.100104 192.168.1.100 -> 192.168.1.1  TCP 66 59570 > http [ACK] Seq=470 Ack=1403 Win=17824 Len=0 TSval=2996909 TSecr=185205
  1.102388  192.168.1.1 -> 192.168.1.100 TCP 101 [TCP segment of a reassembled PDU]
  1.102567 192.168.1.100 -> 192.168.1.1  TCP 66 59570 > http [ACK] Seq=470 Ack=1438 Win=17824 Len=0 TSval=2996909 TSecr=185206
  1.119375  192.168.1.1 -> 192.168.1.100 TCP 93 [TCP segment of a reassembled PDU]
  1.119518 192.168.1.100 -> 192.168.1.1  TCP 66 59570 > http [ACK] Seq=470 Ack=1465 Win=17824 Len=0 TSval=2996914 TSecr=185207
  1.134768  192.168.1.1 -> 192.168.1.100 TCP 87 [TCP segment of a reassembled PDU]
  1.135127 192.168.1.100 -> 192.168.1.1  TCP 66 59570 > http [ACK] Seq=470 Ack=1486 Win=17824 Len=0 TSval=2996918 TSecr=185209
  1.147223  192.168.1.1 -> 192.168.1.100 TCP 161 [TCP segment of a reassembled PDU]
  1.147685 192.168.1.100 -> 192.168.1.1  TCP 66 59570 > http [ACK] Seq=470 Ack=1581 Win=17824 Len=0 TSval=2996921 TSecr=185210
  1.159674  192.168.1.1 -> 192.168.1.100 TCP 134 [TCP segment of a reassembled PDU]
  1.160059 192.168.1.100 -> 192.168.1.1  TCP 66 59570 > http [ACK] Seq=470 Ack=1649 Win=17824 Len=0 TSval=2996924 TSecr=185211
  1.175289  192.168.1.1 -> 192.168.1.100 TCP 87 [TCP segment of a reassembled PDU]
  1.175503 192.168.1.100 -> 192.168.1.1  TCP 66 59570 > http [ACK] Seq=470 Ack=1670 Win=17824 Len=0 TSval=2996928 TSecr=185213
  1.196741  192.168.1.1 -> 192.168.1.100 TCP 91 [TCP segment of a reassembled PDU]
  1.197044 192.168.1.100 -> 192.168.1.1  TCP 66 59570 > http [ACK] Seq=470 Ack=1695 Win=17824 Len=0 TSval=2996933 TSecr=185215
  1.199350  192.168.1.1 -> 192.168.1.100 TCP 209 [TCP segment of a reassembled PDU]
  1.199472 192.168.1.100 -> 192.168.1.1  TCP 66 59570 > http [ACK] Seq=470 Ack=1838 Win=18896 Len=0 TSval=2996934 TSecr=185216
  1.218322  192.168.1.1 -> 192.168.1.100 TCP 75 [TCP segment of a reassembled PDU]
  1.218504  192.168.1.1 -> 192.168.1.100 TCP 1514 [TCP segment of a reassembled PDU]
  1.218553 192.168.1.100 -> 192.168.1.1  TCP 66 59570 > http [ACK] Seq=470 Ack=3295 Win=21792 Len=0 TSval=2996938 TSecr=185217
  1.220704  192.168.1.1 -> 192.168.1.100 HTTP 1363 HTTP/1.0 200 Ok  (text/html)
  1.222271 192.168.1.100 -> 192.168.1.1  TCP 66 59570 > http [FIN, ACK] Seq=470 Ack=4593 Win=24688 Len=0 TSval=2996939 TSecr=185218
  1.228268  192.168.1.1 -> 192.168.1.100 TCP 682 [TCP segment of a reassembled PDU]
  1.228368 192.168.1.100 -> 192.168.1.1  TCP 66 59571 > http [ACK] Seq=409 Ack=617 Win=17504 Len=0 TSval=2996941 TSecr=185218
  1.229995  192.168.1.1 -> 192.168.1.100 TCP 1514 [TCP segment of a reassembled PDU]
  1.230097 192.168.1.100 -> 192.168.1.1  TCP 66 59571 > http [ACK] Seq=409 Ack=2065 Win=20400 Len=0 TSval=2996941 TSecr=185218
  1.238808  192.168.1.1 -> 192.168.1.100 TCP 1514 [TCP segment of a reassembled PDU]
  1.238900 192.168.1.100 -> 192.168.1.1  TCP 66 59571 > http [ACK] Seq=409 Ack=3513 Win=23296 Len=0 TSval=2996944 TSecr=185219
  1.250340  192.168.1.1 -> 192.168.1.100 TCP 66 http > 59570 [ACK] Seq=4593 Ack=471 Win=6864 Len=0 TSval=185221 TSecr=2996939
  1.251971  192.168.1.1 -> 192.168.1.100 TCP 1514 [TCP segment of a reassembled PDU]
  1.252060 192.168.1.100 -> 192.168.1.1  TCP 66 59571 > http [ACK] Seq=409 Ack=4961 Win=26192 Len=0 TSval=2996947 TSecr=185221
  1.252310  192.168.1.1 -> 192.168.1.100 TCP 1514 [TCP segment of a reassembled PDU]
  1.252378 192.168.1.100 -> 192.168.1.1  TCP 66 59571 > http [ACK] Seq=409 Ack=6409 Win=29088 Len=0 TSval=2996947 TSecr=185221
  1.253817  192.168.1.1 -> 192.168.1.100 TCP 1514 [TCP segment of a reassembled PDU]
  1.253897 192.168.1.100 -> 192.168.1.1  TCP 66 59571 > http [ACK] Seq=409 Ack=7857 Win=31984 Len=0 TSval=2996947 TSecr=185221
  1.254211  192.168.1.1 -> 192.168.1.100 TCP 1514 [TCP segment of a reassembled PDU]
  1.254283 192.168.1.100 -> 192.168.1.1  TCP 66 59571 > http [ACK] Seq=409 Ack=9305 Win=34880 Len=0 TSval=2996947 TSecr=185221
  1.255689  192.168.1.1 -> 192.168.1.100 TCP 1514 [TCP segment of a reassembled PDU]
  1.255816 192.168.1.100 -> 192.168.1.1  TCP 66 59571 > http [ACK] Seq=409 Ack=10753 Win=37776 Len=0 TSval=2996948 TSecr=185221
  1.255990  192.168.1.1 -> 192.168.1.100 TCP 1514 [TCP segment of a reassembled PDU]
  1.256166 192.168.1.100 -> 192.168.1.1  TCP 66 59571 > http [ACK] Seq=409 Ack=12201 Win=40672 Len=0 TSval=2996948 TSecr=185221
  1.257543  192.168.1.1 -> 192.168.1.100 TCP 1514 [TCP segment of a reassembled PDU]
  1.257699 192.168.1.100 -> 192.168.1.1  TCP 66 59571 > http [ACK] Seq=409 Ack=13649 Win=41456 Len=0 TSval=2996948 TSecr=185221
  1.273031  192.168.1.1 -> 192.168.1.100 TCP 346 [TCP segment of a reassembled PDU]
  1.273130 192.168.1.100 -> 192.168.1.1  TCP 66 59571 > http [ACK] Seq=409 Ack=13929 Win=42256 Len=0 TSval=2996952 TSecr=185221
  1.276542  192.168.1.1 -> 192.168.1.100 TCP 1514 [TCP segment of a reassembled PDU]
  1.276641 192.168.1.100 -> 192.168.1.1  TCP 66 59571 > http [ACK] Seq=409 Ack=15377 Win=42256 Len=0 TSval=2996953 TSecr=185223
  1.277315  192.168.1.1 -> 192.168.1.100 TCP 1514 [TCP segment of a reassembled PDU]
  1.277388 192.168.1.100 -> 192.168.1.1  TCP 66 59571 > http [ACK] Seq=409 Ack=16825 Win=41456 Len=0 TSval=2996953 TSecr=185223
  1.289292  192.168.1.1 -> 192.168.1.100 TCP 1514 [TCP segment of a reassembled PDU]
  1.289429 192.168.1.100 -> 192.168.1.1  TCP 66 59571 > http [ACK] Seq=409 Ack=18273 Win=42256 Len=0 TSval=2996956 TSecr=185224
  1.299262  192.168.1.1 -> 192.168.1.100 TCP 1514 [TCP segment of a reassembled PDU]
  1.299359 192.168.1.100 -> 192.168.1.1  TCP 66 59571 > http [ACK] Seq=409 Ack=19721 Win=42256 Len=0 TSval=2996959 TSecr=185224
  1.306912  192.168.1.1 -> 192.168.1.100 TCP 1514 [TCP segment of a reassembled PDU]
  1.307067 192.168.1.100 -> 192.168.1.1  TCP 66 59571 > http [ACK] Seq=409 Ack=21169 Win=42256 Len=0 TSval=2996961 TSecr=185225
  1.307184  192.168.1.1 -> 192.168.1.100 TCP 1514 [TCP segment of a reassembled PDU]
  1.307264 192.168.1.100 -> 192.168.1.1  TCP 66 59571 > http [ACK] Seq=409 Ack=22617 Win=41456 Len=0 TSval=2996961 TSecr=185225
  1.307340  192.168.1.1 -> 192.168.1.100 TCP 1514 [TCP segment of a reassembled PDU]
  1.307441 192.168.1.100 -> 192.168.1.1  TCP 66 59571 > http [ACK] Seq=409 Ack=24065 Win=42256 Len=0 TSval=2996961 TSecr=185226
  1.309078  192.168.1.1 -> 192.168.1.100 TCP 1514 [TCP segment of a reassembled PDU]
  1.309171 192.168.1.100 -> 192.168.1.1  TCP 66 59571 > http [ACK] Seq=409 Ack=25513 Win=42256 Len=0 TSval=2996961 TSecr=185226
  1.310691  192.168.1.1 -> 192.168.1.100 TCP 1514 [TCP segment of a reassembled PDU]
  1.310872 192.168.1.100 -> 192.168.1.1  TCP 66 59571 > http [ACK] Seq=409 Ack=26961 Win=42256 Len=0 TSval=2996962 TSecr=185227
  1.311870  192.168.1.1 -> 192.168.1.100 TCP 1514 [TCP segment of a reassembled PDU]
  1.314685  192.168.1.1 -> 192.168.1.100 TCP 1514 [TCP segment of a reassembled PDU]
  1.314823 192.168.1.100 -> 192.168.1.1  TCP 66 59571 > http [ACK] Seq=409 Ack=29857 Win=42256 Len=0 TSval=2996963 TSecr=185227
  1.315983  192.168.1.1 -> 192.168.1.100 TCP 1514 [TCP segment of a reassembled PDU]
  1.322827  192.168.1.1 -> 192.168.1.100 TCP 87 [TCP segment of a reassembled PDU]
  1.322965 192.168.1.100 -> 192.168.1.1  TCP 66 59571 > http [ACK] Seq=409 Ack=31326 Win=42256 Len=0 TSval=2996965 TSecr=185227
  1.323477  192.168.1.1 -> 192.168.1.100 HTTP 66 HTTP/1.0 200 Ok  (text/javascript)
  1.325917 192.168.1.100 -> 192.168.1.1  TCP 66 59571 > http [FIN, ACK] Seq=409 Ack=31327 Win=42256 Len=0 TSval=2996965 TSecr=185227
  1.334295  192.168.1.1 -> 192.168.1.100 DNS 376 Standard query response A 108.160.162.100 A 108.160.163.34 A 108.160.163.35 A 108.160.162.38 A 108.160.162.50 A 108.160.162.98
  1.335241 192.168.1.100 -> 108.160.162.100 TCP 74 38928 > http [SYN] Seq=0 Win=14600 Len=0 MSS=1460 SACK_PERM=1 TSval=2996968 TSecr=0 WS=16
  1.336726  192.168.1.1 -> 192.168.1.100 TCP 66 http > 59571 [ACK] Seq=31327 Ack=410 Win=6864 Len=0 TSval=185229 TSecr=2996965
  1.376074 192.168.1.100 -> 192.168.1.1  TCP 74 59573 > http [SYN] Seq=0 Win=14600 Len=0 MSS=1460 SACK_PERM=1 TSval=2996978 TSecr=0 WS=16
  1.377152 192.168.1.100 -> 192.168.1.1  TCP 74 59574 > http [SYN] Seq=0 Win=14600 Len=0 MSS=1460 SACK_PERM=1 TSval=2996978 TSecr=0 WS=16
  1.378451 192.168.1.100 -> 192.168.1.1  TCP 74 59575 > http [SYN] Seq=0 Win=14600 Len=0 MSS=1460 SACK_PERM=1 TSval=2996978 TSecr=0 WS=16
  1.378616  192.168.1.1 -> 192.168.1.100 TCP 74 http > 59573 [SYN, ACK] Seq=0 Ack=1 Win=5792 Len=0 MSS=1460 SACK_PERM=1 TSval=185234 TSecr=2996978 WS=2
  1.378705 192.168.1.100 -> 192.168.1.1  TCP 66 59573 > http [ACK] Seq=1 Ack=1 Win=14608 Len=0 TSval=2996978 TSecr=185234
  1.380000 192.168.1.100 -> 192.168.1.1  TCP 74 59576 > http [SYN] Seq=0 Win=14600 Len=0 MSS=1460 SACK_PERM=1 TSval=2996979 TSecr=0 WS=16
  1.380207  192.168.1.1 -> 192.168.1.100 TCP 74 http > 59574 [SYN, ACK] Seq=0 Ack=1 Win=5792 Len=0 MSS=1460 SACK_PERM=1 TSval=185234 TSecr=2996978 WS=2
  1.380304 192.168.1.100 -> 192.168.1.1  TCP 66 59574 > http [ACK] Seq=1 Ack=1 Win=14608 Len=0 TSval=2996979 TSecr=185234
  1.381554  192.168.1.1 -> 192.168.1.100 TCP 74 http > 59575 [SYN, ACK] Seq=0 Ack=1 Win=5792 Len=0 MSS=1460 SACK_PERM=1 TSval=185234 TSecr=2996978 WS=2
  1.381676 192.168.1.100 -> 192.168.1.1  TCP 66 59575 > http [ACK] Seq=1 Ack=1 Win=14608 Len=0 TSval=2996979 TSecr=185234
  1.383512 192.168.1.100 -> 192.168.1.1  TCP 74 59577 > http [SYN] Seq=0 Win=14600 Len=0 MSS=1460 SACK_PERM=1 TSval=2996980 TSecr=0 WS=16
  1.384000  192.168.1.1 -> 192.168.1.100 TCP 74 http > 59576 [SYN, ACK] Seq=0 Ack=1 Win=5792 Len=0 MSS=1460 SACK_PERM=1 TSval=185234 TSecr=2996979 WS=2
  1.384114 192.168.1.100 -> 192.168.1.1  TCP 66 59576 > http [ACK] Seq=1 Ack=1 Win=14608 Len=0 TSval=2996980 TSecr=185234
  1.384457 192.168.1.100 -> 192.168.1.1  TCP 74 59578 > http [SYN] Seq=0 Win=14600 Len=0 MSS=1460 SACK_PERM=1 TSval=2996980 TSecr=0 WS=16
  1.385594 192.168.1.100 -> 192.168.1.1  HTTP 448 GET /images/batt2.gif HTTP/1.1 
  1.386071 192.168.1.100 -> 192.168.1.1  HTTP 457 GET /images/sms_new1_index.gif HTTP/1.1 
  1.386514 192.168.1.100 -> 192.168.1.1  HTTP 460 GET /images/wan_connect_index.gif HTTP/1.1 
  1.387033 192.168.1.100 -> 192.168.1.1  HTTP 455 GET /images/WIFI_index_2.gif HTTP/1.1 
  1.387158  192.168.1.1 -> 192.168.1.100 TCP 74 http > 59577 [SYN, ACK] Seq=0 Ack=1 Win=5792 Len=0 MSS=1460 SACK_PERM=1 TSval=185234 TSecr=2996980 WS=2
  1.387234 192.168.1.100 -> 192.168.1.1  TCP 66 59577 > http [ACK] Seq=1 Ack=1 Win=14608 Len=0 TSval=2996981 TSecr=185234
  1.388538 192.168.1.100 -> 192.168.1.1  HTTP 449 GET /images/level2.gif HTTP/1.1 
  1.389664  192.168.1.1 -> 192.168.1.100 TCP 74 http > 59578 [SYN, ACK] Seq=0 Ack=1 Win=5792 Len=0 MSS=1460 SACK_PERM=1 TSval=185235 TSecr=2996980 WS=2
  1.389806 192.168.1.100 -> 192.168.1.1  TCP 66 59578 > http [ACK] Seq=1 Ack=1 Win=14608 Len=0 TSval=2996981 TSecr=185235
  1.390458 192.168.1.100 -> 192.168.1.1  HTTP 458 GET /images/network_h_index.gif HTTP/1.1 
  1.396294  192.168.1.1 -> 192.168.1.100 TCP 66 http > 59573 [ACK] Seq=1 Ack=383 Win=6864 Len=0 TSval=185235 TSecr=2996980
  1.396439  192.168.1.1 -> 192.168.1.100 TCP 311 [TCP segment of a reassembled PDU]
  1.396535 192.168.1.100 -> 192.168.1.1  TCP 66 59573 > http [ACK] Seq=383 Ack=246 Win=15680 Len=0 TSval=2996983 TSecr=185235
  1.401466  192.168.1.1 -> 192.168.1.100 HTTP 66 HTTP/1.0 200 Ok  (GIF89a) (GIF89a) (image/gif)
  1.402069  192.168.1.1 -> 192.168.1.100 TCP 66 http > 59574 [ACK] Seq=1 Ack=392 Win=6864 Len=0 TSval=185235 TSecr=2996980
  1.402108 192.168.1.100 -> 192.168.1.1  TCP 66 59573 > http [FIN, ACK] Seq=383 Ack=247 Win=15680 Len=0 TSval=2996984 TSecr=185235
  1.402229  192.168.1.1 -> 192.168.1.100 TCP 328 [TCP segment of a reassembled PDU]
  1.402284 192.168.1.100 -> 192.168.1.1  TCP 66 59574 > http [ACK] Seq=392 Ack=263 Win=15680 Len=0 TSval=2996984 TSecr=185236
  1.402802 192.168.1.100 -> 192.168.1.1  TCP 74 59579 > http [SYN] Seq=0 Win=14600 Len=0 MSS=1460 SACK_PERM=1 TSval=2996984 TSecr=0 WS=16
  1.406698  192.168.1.1 -> 192.168.1.100 HTTP 66 HTTP/1.0 200 Ok  (GIF89a) (GIF89a) (image/gif)
  1.407506 192.168.1.100 -> 192.168.1.1  TCP 66 59574 > http [FIN, ACK] Seq=392 Ack=264 Win=15680 Len=0 TSval=2996986 TSecr=185236
  1.407682  192.168.1.1 -> 192.168.1.100 TCP 66 http > 59575 [ACK] Seq=1 Ack=395 Win=6864 Len=0 TSval=185236 TSecr=2996980
  1.408036  192.168.1.1 -> 192.168.1.100 TCP 313 [TCP segment of a reassembled PDU]
  1.408124 192.168.1.100 -> 192.168.1.1  TCP 66 59575 > http [ACK] Seq=395 Ack=248 Win=15680 Len=0 TSval=2996986 TSecr=185236
  1.415314  192.168.1.1 -> 192.168.1.100 HTTP 66 HTTP/1.0 200 Ok  (GIF89a) (GIF89a) (image/gif)
  1.415663 192.168.1.100 -> 192.168.1.1  TCP 66 59575 > http [FIN, ACK] Seq=395 Ack=249 Win=15680 Len=0 TSval=2996988 TSecr=185236
  1.421483  192.168.1.1 -> 192.168.1.100 TCP 66 http > 59576 [ACK] Seq=1 Ack=390 Win=6864 Len=0 TSval=185237 TSecr=2996981
  1.421657  192.168.1.1 -> 192.168.1.100 TCP 355 [TCP segment of a reassembled PDU]
  1.421738 192.168.1.100 -> 192.168.1.1  TCP 66 59576 > http [ACK] Seq=390 Ack=290 Win=15680 Len=0 TSval=2996989 TSecr=185237
  1.426915  192.168.1.1 -> 192.168.1.100 HTTP 66 HTTP/1.0 200 Ok  (GIF89a) (GIF89a) (image/gif)
  1.427042  192.168.1.1 -> 192.168.1.100 TCP 66 http > 59577 [ACK] Seq=1 Ack=384 Win=6864 Len=0 TSval=185237 TSecr=2996981
  1.427156 192.168.1.100 -> 192.168.1.1  TCP 66 59576 > http [FIN, ACK] Seq=390 Ack=291 Win=15680 Len=0 TSval=2996991 TSecr=185237
  1.427331  192.168.1.1 -> 192.168.1.100 TCP 294 [TCP segment of a reassembled PDU]
  1.427403 192.168.1.100 -> 192.168.1.1  TCP 66 59577 > http [ACK] Seq=384 Ack=229 Win=15680 Len=0 TSval=2996991 TSecr=185238
  1.429755  192.168.1.1 -> 192.168.1.100 HTTP 66 HTTP/1.0 200 Ok  (GIF89a) (GIF89a) (image/gif)
  1.430093  192.168.1.1 -> 192.168.1.100 TCP 66 http > 59578 [ACK] Seq=1 Ack=393 Win=6864 Len=0 TSval=185238 TSecr=2996981
  1.431572  192.168.1.1 -> 192.168.1.100 TCP 290 [TCP segment of a reassembled PDU]
  1.431675 192.168.1.100 -> 192.168.1.1  TCP 66 59578 > http [ACK] Seq=393 Ack=225 Win=15680 Len=0 TSval=2996992 TSecr=185238
  1.433553  192.168.1.1 -> 192.168.1.100 HTTP 66 HTTP/1.0 200 Ok  (GIF89a) (GIF89a) (image/gif)
  1.434467  192.168.1.1 -> 192.168.1.100 TCP 66 http > 59573 [ACK] Seq=247 Ack=384 Win=6864 Len=0 TSval=185238 TSecr=2996984
  1.434613  192.168.1.1 -> 192.168.1.100 TCP 74 http > 59579 [SYN, ACK] Seq=0 Ack=1 Win=5792 Len=0 MSS=1460 SACK_PERM=1 TSval=185239 TSecr=2996984 WS=2
  1.434691 192.168.1.100 -> 192.168.1.1  TCP 66 59579 > http [ACK] Seq=1 Ack=1 Win=14608 Len=0 TSval=2996992 TSecr=185239
  1.435875  192.168.1.1 -> 192.168.1.100 TCP 66 http > 59574 [ACK] Seq=264 Ack=393 Win=6864 Len=0 TSval=185239 TSecr=2996986
  1.436024  192.168.1.1 -> 192.168.1.100 TCP 66 http > 59575 [ACK] Seq=249 Ack=396 Win=6864 Len=0 TSval=185239 TSecr=2996988
  1.436388  192.168.1.1 -> 192.168.1.100 TCP 66 http > 59576 [ACK] Seq=291 Ack=391 Win=6864 Len=0 TSval=185239 TSecr=2996991
  1.436787 192.168.1.100 -> 192.168.1.1  TCP 66 59577 > http [FIN, ACK] Seq=384 Ack=230 Win=15680 Len=0 TSval=2996993 TSecr=185238
  1.441101  192.168.1.1 -> 192.168.1.100 TCP 66 http > 59577 [ACK] Seq=230 Ack=385 Win=6864 Len=0 TSval=185240 TSecr=2996993
  1.442141 192.168.1.100 -> 192.168.1.1  HTTP 396 GET /favicon.ico HTTP/1.1 
  1.443204 192.168.1.100 -> 192.168.1.1  TCP 66 59578 > http [FIN, ACK] Seq=393 Ack=226 Win=15680 Len=0 TSval=2996995 TSecr=185238
  1.445227  192.168.1.1 -> 192.168.1.100 TCP 66 http > 59578 [ACK] Seq=226 Ack=394 Win=6864 Len=0 TSval=185240 TSecr=2996995
  1.449779  192.168.1.1 -> 192.168.1.100 TCP 66 http > 59579 [ACK] Seq=1 Ack=331 Win=6864 Len=0 TSval=185240 TSecr=2996994
  1.450073  192.168.1.1 -> 192.168.1.100 TCP 760 [TCP segment of a reassembled PDU]
  1.450151 192.168.1.100 -> 192.168.1.1  TCP 66 59579 > http [ACK] Seq=331 Ack=695 Win=17504 Len=0 TSval=2996996 TSecr=185241
  1.450447  192.168.1.1 -> 192.168.1.100 HTTP 977 HTTP/1.0 200 Ok  (text/html)
  1.450523 192.168.1.100 -> 192.168.1.1  TCP 66 59579 > http [ACK] Seq=331 Ack=1607 Win=19328 Len=0 TSval=2996996 TSecr=185241
  1.454221 192.168.1.100 -> 192.168.1.1  TCP 66 59579 > http [FIN, ACK] Seq=331 Ack=1607 Win=19328 Len=0 TSval=2996997 TSecr=185241
  1.456230  192.168.1.1 -> 192.168.1.100 TCP 66 http > 59579 [ACK] Seq=1607 Ack=332 Win=6864 Len=0 TSval=185241 TSecr=2996997
  1.873723  192.168.1.1 -> 192.168.1.100 DNS 320 Standard query response CNAME client.v.dropbox.com A 108.160.161.178
  1.874702 192.168.1.100 -> 108.160.161.178 TCP 74 36045 > https [SYN] Seq=0 Win=14600 Len=0 MSS=1460 SACK_PERM=1 TSval=2997102 TSecr=0 WS=16
  2.046698 108.160.162.100 -> 192.168.1.100 TCP 74 http > 38928 [SYN, ACK] Seq=0 Ack=1 Win=14480 Len=0 MSS=1400 SACK_PERM=1 TSval=742223279 TSecr=2996968 WS=512
  2.046928 192.168.1.100 -> 108.160.162.100 TCP 66 38928 > http [ACK] Seq=1 Ack=1 Win=14608 Len=0 TSval=2997146 TSecr=742223279
  2.068410 192.168.1.100 -> 108.160.162.100 HTTP 260 GET /subscribe?host_int=23200062&ns_map=15064068_137692371606532&ts=1367304835 HTTP/1.1 
  2.316608 108.160.161.178 -> 192.168.1.100 TCP 74 https > 36045 [SYN, ACK] Seq=0 Ack=1 Win=14480 Len=0 MSS=1400 SACK_PERM=1 TSval=815241208 TSecr=2997102 WS=512
  2.316741 192.168.1.100 -> 108.160.161.178 TCP 66 36045 > https [ACK] Seq=1 Ack=1 Win=14608 Len=0 TSval=2997213 TSecr=815241208
  2.320541 192.168.1.100 -> 108.160.161.178 SSL 162 Client Hello
  3.052644 192.168.1.100 -> 255.255.255.255 DB-LSP-DISC 151 Dropbox LAN sync Discovery Protocol
  3.053959 192.168.1.100 -> 192.168.1.255 DB-LSP-DISC 151 Dropbox LAN sync Discovery Protocol
  3.246474 192.168.1.100 -> 255.255.255.255 DB-LSP-DISC 151 Dropbox LAN sync Discovery Protocol
  3.248293 192.168.1.100 -> 192.168.1.255 DB-LSP-DISC 151 Dropbox LAN sync Discovery Protocol
  3.654819 192.168.1.100 -> 108.160.161.178 SSL 162 [TCP Retransmission] Client Hello
  3.896793 108.160.162.100 -> 192.168.1.100 TCP 66 http > 38928 [ACK] Seq=1 Ack=195 Win=15872 Len=0 TSval=742223742 TSecr=2997151
  6.326835 192.168.1.100 -> 108.160.161.178 SSL 162 [TCP Retransmission] Client Hello
  6.771595 192.168.1.100 -> 192.168.1.1  TCP 74 59581 > http [SYN] Seq=0 Win=14600 Len=0 MSS=1460 SACK_PERM=1 TSval=2998327 TSecr=0 WS=16
  6.773874  192.168.1.1 -> 192.168.1.100 TCP 74 http > 59581 [SYN, ACK] Seq=0 Ack=1 Win=5792 Len=0 MSS=1460 SACK_PERM=1 TSval=185773 TSecr=2998327 WS=2
  6.773991 192.168.1.100 -> 192.168.1.1  TCP 66 59581 > http [ACK] Seq=1 Ack=1 Win=14608 Len=0 TSval=2998327 TSecr=185773
  6.774831 192.168.1.100 -> 192.168.1.1  HTTP 535 GET /en/conn_index.asp HTTP/1.1 
  6.789394  192.168.1.1 -> 192.168.1.100 TCP 66 http > 59581 [ACK] Seq=1 Ack=470 Win=6864 Len=0 TSval=185773 TSecr=2998328
  6.829002  192.168.1.1 -> 192.168.1.100 TCP 525 [TCP segment of a reassembled PDU]
  6.829097 192.168.1.100 -> 192.168.1.1  TCP 66 59581 > http [ACK] Seq=470 Ack=460 Win=15680 Len=0 TSval=2998341 TSecr=185778
  6.851674  192.168.1.1 -> 192.168.1.100 TCP 84 [TCP segment of a reassembled PDU]
  6.851768 192.168.1.100 -> 192.168.1.1  TCP 66 59581 > http [ACK] Seq=470 Ack=478 Win=15680 Len=0 TSval=2998347 TSecr=185780
  6.854039  192.168.1.1 -> 192.168.1.100 TCP 142 [TCP segment of a reassembled PDU]
  6.854130 192.168.1.100 -> 192.168.1.1  TCP 66 59581 > http [ACK] Seq=470 Ack=554 Win=15680 Len=0 TSval=2998347 TSecr=185781
  6.862676  192.168.1.1 -> 192.168.1.100 TCP 97 [TCP segment of a reassembled PDU]
  6.862804 192.168.1.100 -> 192.168.1.1  TCP 66 59581 > http [ACK] Seq=470 Ack=585 Win=15680 Len=0 TSval=2998350 TSecr=185781
  6.863920 192.168.1.100 -> 192.168.1.1  TCP 74 59582 > http [SYN] Seq=0 Win=14600 Len=0 MSS=1460 SACK_PERM=1 TSval=2998350 TSecr=0 WS=16
  6.865867  192.168.1.1 -> 192.168.1.100 TCP 74 http > 59582 [SYN, ACK] Seq=0 Ack=1 Win=5792 Len=0 MSS=1460 SACK_PERM=1 TSval=185782 TSecr=2998350 WS=2
  6.865992 192.168.1.100 -> 192.168.1.1  TCP 66 59582 > http [ACK] Seq=1 Ack=1 Win=14608 Len=0 TSval=2998350 TSecr=185782
  6.867554 192.168.1.100 -> 192.168.1.1  HTTP 474 GET /js/help_index.js HTTP/1.1 
  6.877296  192.168.1.1 -> 192.168.1.100 TCP 175 [TCP segment of a reassembled PDU]
  6.877389 192.168.1.100 -> 192.168.1.1  TCP 66 59581 > http [ACK] Seq=470 Ack=694 Win=15680 Len=0 TSval=2998353 TSecr=185783
  6.880925  192.168.1.1 -> 192.168.1.100 TCP 66 http > 59582 [ACK] Seq=1 Ack=409 Win=6864 Len=0 TSval=185784 TSecr=2998351
  6.898823  192.168.1.1 -> 192.168.1.100 TCP 294 [TCP segment of a reassembled PDU]
  6.898931 192.168.1.100 -> 192.168.1.1  TCP 66 59581 > http [ACK] Seq=470 Ack=922 Win=16752 Len=0 TSval=2998359 TSecr=185785
  6.919345  192.168.1.1 -> 192.168.1.100 TCP 86 [TCP segment of a reassembled PDU]
  6.919495 192.168.1.100 -> 192.168.1.1  TCP 66 59581 > http [ACK] Seq=470 Ack=942 Win=16752 Len=0 TSval=2998364 TSecr=185787
  6.922195  192.168.1.1 -> 192.168.1.100 TCP 91 [TCP segment of a reassembled PDU]
  6.922342 192.168.1.100 -> 192.168.1.1  TCP 66 59581 > http [ACK] Seq=470 Ack=967 Win=16752 Len=0 TSval=2998364 TSecr=185788
  6.935577  192.168.1.1 -> 192.168.1.100 TCP 154 [TCP segment of a reassembled PDU]
  6.935708 192.168.1.100 -> 192.168.1.1  TCP 66 59581 > http [ACK] Seq=470 Ack=1055 Win=16752 Len=0 TSval=2998368 TSecr=185789
  6.955036  192.168.1.1 -> 192.168.1.100 TCP 238 [TCP segment of a reassembled PDU]
  6.955165 192.168.1.100 -> 192.168.1.1  TCP 66 59581 > http [ACK] Seq=470 Ack=1227 Win=17824 Len=0 TSval=2998373 TSecr=185791
  6.988775  192.168.1.1 -> 192.168.1.100 TCP 125 [TCP segment of a reassembled PDU]
  6.988890 192.168.1.100 -> 192.168.1.1  TCP 66 59581 > http [ACK] Seq=470 Ack=1286 Win=17824 Len=0 TSval=2998381 TSecr=185793
  7.109279  192.168.1.1 -> 192.168.1.100 TCP 182 [TCP segment of a reassembled PDU]
  7.109365 192.168.1.100 -> 192.168.1.1  TCP 66 59581 > http [ACK] Seq=470 Ack=1402 Win=17824 Len=0 TSval=2998411 TSecr=185806
  7.111418  192.168.1.1 -> 192.168.1.100 TCP 101 [TCP segment of a reassembled PDU]
  7.111511 192.168.1.100 -> 192.168.1.1  TCP 66 59581 > http [ACK] Seq=470 Ack=1437 Win=17824 Len=0 TSval=2998412 TSecr=185807
  7.128793  192.168.1.1 -> 192.168.1.100 TCP 93 [TCP segment of a reassembled PDU]
  7.128887 192.168.1.100 -> 192.168.1.1  TCP 66 59581 > http [ACK] Seq=470 Ack=1464 Win=17824 Len=0 TSval=2998416 TSecr=185808
  7.143778  192.168.1.1 -> 192.168.1.100 TCP 87 [TCP segment of a reassembled PDU]
  7.144117 192.168.1.100 -> 192.168.1.1  TCP 66 59581 > http [ACK] Seq=470 Ack=1485 Win=17824 Len=0 TSval=2998420 TSecr=185810
  7.154658  192.168.1.1 -> 192.168.1.100 TCP 161 [TCP segment of a reassembled PDU]
  7.154950 192.168.1.100 -> 192.168.1.1  TCP 66 59581 > http [ACK] Seq=470 Ack=1580 Win=17824 Len=0 TSval=2998423 TSecr=185811
  7.169046  192.168.1.1 -> 192.168.1.100 TCP 134 [TCP segment of a reassembled PDU]
  7.169283 192.168.1.100 -> 192.168.1.1  TCP 66 59581 > http [ACK] Seq=470 Ack=1648 Win=17824 Len=0 TSval=2998426 TSecr=185812
  7.185093  192.168.1.1 -> 192.168.1.100 TCP 87 [TCP segment of a reassembled PDU]
  7.185358 192.168.1.100 -> 192.168.1.1  TCP 66 59581 > http [ACK] Seq=470 Ack=1669 Win=17824 Len=0 TSval=2998430 TSecr=185814
  7.207069  192.168.1.1 -> 192.168.1.100 TCP 91 [TCP segment of a reassembled PDU]
  7.207292 192.168.1.100 -> 192.168.1.1  TCP 66 59581 > http [ACK] Seq=470 Ack=1694 Win=17824 Len=0 TSval=2998436 TSecr=185816
  7.209655  192.168.1.1 -> 192.168.1.100 TCP 209 [TCP segment of a reassembled PDU]
  7.209800 192.168.1.100 -> 192.168.1.1  TCP 66 59581 > http [ACK] Seq=470 Ack=1837 Win=18896 Len=0 TSval=2998436 TSecr=185817
  7.228355  192.168.1.1 -> 192.168.1.100 TCP 75 [TCP segment of a reassembled PDU]
  7.228604 192.168.1.100 -> 192.168.1.1  TCP 66 59581 > http [ACK] Seq=470 Ack=1846 Win=18896 Len=0 TSval=2998441 TSecr=185818
  7.228827  192.168.1.1 -> 192.168.1.100 TCP 1514 [TCP segment of a reassembled PDU]
  7.228881 192.168.1.100 -> 192.168.1.1  TCP 66 59581 > http [ACK] Seq=470 Ack=3294 Win=21792 Len=0 TSval=2998441 TSecr=185818
  7.229865  192.168.1.1 -> 192.168.1.100 HTTP 1363 HTTP/1.0 200 Ok  (text/html)
  7.231137 192.168.1.100 -> 192.168.1.1  TCP 66 59581 > http [FIN, ACK] Seq=470 Ack=4592 Win=24688 Len=0 TSval=2998442 TSecr=185819
  7.238646  192.168.1.1 -> 192.168.1.100 TCP 682 [TCP segment of a reassembled PDU]
  7.238792 192.168.1.100 -> 192.168.1.1  TCP 66 59582 > http [ACK] Seq=409 Ack=617 Win=17504 Len=0 TSval=2998444 TSecr=185819
  7.240522  192.168.1.1 -> 192.168.1.100 TCP 1514 [TCP segment of a reassembled PDU]
  7.240620 192.168.1.100 -> 192.168.1.1  TCP 66 59582 > http [ACK] Seq=409 Ack=2065 Win=20400 Len=0 TSval=2998444 TSecr=185819
  7.248731  192.168.1.1 -> 192.168.1.100 TCP 1514 [TCP segment of a reassembled PDU]
  7.248831 192.168.1.100 -> 192.168.1.1  TCP 66 59582 > http [ACK] Seq=409 Ack=3513 Win=23296 Len=0 TSval=2998446 TSecr=185820
  7.261222  192.168.1.1 -> 192.168.1.100 TCP 66 http > 59581 [ACK] Seq=4592 Ack=471 Win=6864 Len=0 TSval=185822 TSecr=2998442
  7.262931  192.168.1.1 -> 192.168.1.100 TCP 1514 [TCP segment of a reassembled PDU]
  7.263056 192.168.1.100 -> 192.168.1.1  TCP 66 59582 > http [ACK] Seq=409 Ack=4961 Win=26192 Len=0 TSval=2998450 TSecr=185822
  7.263233  192.168.1.1 -> 192.168.1.100 TCP 1514 [TCP segment of a reassembled PDU]
  7.263314 192.168.1.100 -> 192.168.1.1  TCP 66 59582 > http [ACK] Seq=409 Ack=6409 Win=29088 Len=0 TSval=2998450 TSecr=185822
  7.264647  192.168.1.1 -> 192.168.1.100 TCP 1514 [TCP segment of a reassembled PDU]
  7.264752 192.168.1.100 -> 192.168.1.1  TCP 66 59582 > http [ACK] Seq=409 Ack=7857 Win=31984 Len=0 TSval=2998450 TSecr=185822
  7.265068  192.168.1.1 -> 192.168.1.100 TCP 1514 [TCP segment of a reassembled PDU]
  7.265144 192.168.1.100 -> 192.168.1.1  TCP 66 59582 > http [ACK] Seq=409 Ack=9305 Win=34880 Len=0 TSval=2998450 TSecr=185822
  7.266467  192.168.1.1 -> 192.168.1.100 TCP 1514 [TCP segment of a reassembled PDU]
  7.266548 192.168.1.100 -> 192.168.1.1  TCP 66 59582 > http [ACK] Seq=409 Ack=10753 Win=37776 Len=0 TSval=2998450 TSecr=185822
  7.266825  192.168.1.1 -> 192.168.1.100 TCP 1514 [TCP segment of a reassembled PDU]
  7.266886 192.168.1.100 -> 192.168.1.1  TCP 66 59582 > http [ACK] Seq=409 Ack=12201 Win=40336 Len=0 TSval=2998451 TSecr=185822
  7.268306  192.168.1.1 -> 192.168.1.100 TCP 1514 [TCP segment of a reassembled PDU]
  7.268396 192.168.1.100 -> 192.168.1.1  TCP 66 59582 > http [ACK] Seq=409 Ack=13649 Win=42256 Len=0 TSval=2998451 TSecr=185822
  7.278417  192.168.1.1 -> 192.168.1.100 TCP 346 [TCP segment of a reassembled PDU]
  7.278531 192.168.1.100 -> 192.168.1.1  TCP 66 59582 > http [ACK] Seq=409 Ack=13929 Win=42256 Len=0 TSval=2998453 TSecr=185823
  7.279664  192.168.1.1 -> 192.168.1.100 TCP 1514 [TCP segment of a reassembled PDU]
  7.279773 192.168.1.100 -> 192.168.1.1  TCP 66 59582 > http [ACK] Seq=409 Ack=15377 Win=41968 Len=0 TSval=2998454 TSecr=185823
  7.286278  192.168.1.1 -> 192.168.1.100 TCP 666 [TCP segment of a reassembled PDU]
  7.286384 192.168.1.100 -> 192.168.1.1  TCP 66 59582 > http [ACK] Seq=409 Ack=15977 Win=42256 Len=0 TSval=2998455 TSecr=185824
  7.295066  192.168.1.1 -> 192.168.1.100 TCP 1014 [TCP segment of a reassembled PDU]
  7.295175 192.168.1.100 -> 192.168.1.1  TCP 66 59582 > http [ACK] Seq=409 Ack=16925 Win=42256 Len=0 TSval=2998458 TSecr=185825
  7.308396  192.168.1.1 -> 192.168.1.100 TCP 90 [TCP segment of a reassembled PDU]
  7.308546 192.168.1.100 -> 192.168.1.1  TCP 66 59582 > http [ACK] Seq=409 Ack=16949 Win=42256 Len=0 TSval=2998461 TSecr=185825
  7.308917  192.168.1.1 -> 192.168.1.100 TCP 1514 [TCP segment of a reassembled PDU]
  7.309018 192.168.1.100 -> 192.168.1.1  TCP 66 59582 > http [ACK] Seq=409 Ack=18397 Win=42256 Len=0 TSval=2998461 TSecr=185826
  7.309746  192.168.1.1 -> 192.168.1.100 TCP 1514 [TCP segment of a reassembled PDU]
  7.309848 192.168.1.100 -> 192.168.1.1  TCP 66 59582 > http [ACK] Seq=409 Ack=19845 Win=42256 Len=0 TSval=2998461 TSecr=185826
  7.318798  192.168.1.1 -> 192.168.1.100 TCP 1514 [TCP segment of a reassembled PDU]
  7.318925 192.168.1.100 -> 192.168.1.1  TCP 66 59582 > http [ACK] Seq=409 Ack=21293 Win=42256 Len=0 TSval=2998464 TSecr=185826
  7.325980  192.168.1.1 -> 192.168.1.100 TCP 1514 [TCP segment of a reassembled PDU]
  7.326116 192.168.1.100 -> 192.168.1.1  TCP 66 59582 > http [ACK] Seq=409 Ack=22741 Win=42256 Len=0 TSval=2998465 TSecr=185827
  7.326230  192.168.1.1 -> 192.168.1.100 TCP 1514 [TCP segment of a reassembled PDU]
  7.326304 192.168.1.100 -> 192.168.1.1  TCP 66 59582 > http [ACK] Seq=409 Ack=24189 Win=41456 Len=0 TSval=2998465 TSecr=185827
  7.328101  192.168.1.1 -> 192.168.1.100 TCP 1514 [TCP segment of a reassembled PDU]
  7.328255  192.168.1.1 -> 192.168.1.100 TCP 1514 [TCP segment of a reassembled PDU]
  7.328338 192.168.1.100 -> 192.168.1.1  TCP 66 59582 > http [ACK] Seq=409 Ack=27085 Win=41456 Len=0 TSval=2998466 TSecr=185827
  7.328736  192.168.1.1 -> 192.168.1.100 TCP 1514 [TCP segment of a reassembled PDU]
  7.330409  192.168.1.1 -> 192.168.1.100 TCP 1514 [TCP segment of a reassembled PDU]
  7.330525 192.168.1.100 -> 192.168.1.1  TCP 66 59582 > http [ACK] Seq=409 Ack=29981 Win=42256 Len=0 TSval=2998466 TSecr=185828
  7.330815  192.168.1.1 -> 192.168.1.100 HTTP 1411 HTTP/1.0 200 Ok  (text/javascript)
  7.333005 192.168.1.100 -> 192.168.1.1  TCP 66 59582 > http [FIN, ACK] Seq=409 Ack=31327 Win=42256 Len=0 TSval=2998467 TSecr=185829
  7.336199  192.168.1.1 -> 192.168.1.100 TCP 66 http > 59582 [ACK] Seq=31327 Ack=410 Win=6864 Len=0 TSval=185829 TSecr=2998467
  7.402634 192.168.1.100 -> 192.168.1.1  TCP 74 59583 > http [SYN] Seq=0 Win=14600 Len=0 MSS=1460 SACK_PERM=1 TSval=2998484 TSecr=0 WS=16
  7.403879 192.168.1.100 -> 192.168.1.1  TCP 74 59584 > http [SYN] Seq=0 Win=14600 Len=0 MSS=1460 SACK_PERM=1 TSval=2998485 TSecr=0 WS=16
  7.405036  192.168.1.1 -> 192.168.1.100 TCP 74 http > 59583 [SYN, ACK] Seq=0 Ack=1 Win=5792 Len=0 MSS=1460 SACK_PERM=1 TSval=185836 TSecr=2998484 WS=2
  7.405158 192.168.1.100 -> 192.168.1.1  TCP 66 59583 > http [ACK] Seq=1 Ack=1 Win=14608 Len=0 TSval=2998485 TSecr=185836
  7.406449  192.168.1.1 -> 192.168.1.100 TCP 74 http > 59584 [SYN, ACK] Seq=0 Ack=1 Win=5792 Len=0 MSS=1460 SACK_PERM=1 TSval=185836 TSecr=2998485 WS=2
  7.406585 192.168.1.100 -> 192.168.1.1  TCP 66 59584 > http [ACK] Seq=1 Ack=1 Win=14608 Len=0 TSval=2998485 TSecr=185836
  7.406932 192.168.1.100 -> 192.168.1.1  TCP 74 59585 > http [SYN] Seq=0 Win=14600 Len=0 MSS=1460 SACK_PERM=1 TSval=2998486 TSecr=0 WS=16
  7.408334 192.168.1.100 -> 192.168.1.1  TCP 74 59586 > http [SYN] Seq=0 Win=14600 Len=0 MSS=1460 SACK_PERM=1 TSval=2998486 TSecr=0 WS=16
  7.409347 192.168.1.100 -> 192.168.1.1  TCP 74 59587 > http [SYN] Seq=0 Win=14600 Len=0 MSS=1460 SACK_PERM=1 TSval=2998486 TSecr=0 WS=16
  7.410108  192.168.1.1 -> 192.168.1.100 TCP 74 http > 59585 [SYN, ACK] Seq=0 Ack=1 Win=5792 Len=0 MSS=1460 SACK_PERM=1 TSval=185837 TSecr=2998486 WS=2
  7.410240 192.168.1.100 -> 192.168.1.1  TCP 66 59585 > http [ACK] Seq=1 Ack=1 Win=14608 Len=0 TSval=2998486 TSecr=185837
  7.411545  192.168.1.1 -> 192.168.1.100 TCP 74 http > 59586 [SYN, ACK] Seq=0 Ack=1 Win=5792 Len=0 MSS=1460 SACK_PERM=1 TSval=185837 TSecr=2998486 WS=2
  7.411678 192.168.1.100 -> 192.168.1.1  TCP 66 59586 > http [ACK] Seq=1 Ack=1 Win=14608 Len=0 TSval=2998487 TSecr=185837
  7.412942  192.168.1.1 -> 192.168.1.100 TCP 74 http > 59587 [SYN, ACK] Seq=0 Ack=1 Win=5792 Len=0 MSS=1460 SACK_PERM=1 TSval=185837 TSecr=2998486 WS=2
  7.413074 192.168.1.100 -> 192.168.1.1  TCP 66 59587 > http [ACK] Seq=1 Ack=1 Win=14608 Len=0 TSval=2998487 TSecr=185837
  7.414696 192.168.1.100 -> 192.168.1.1  TCP 74 59588 > http [SYN] Seq=0 Win=14600 Len=0 MSS=1460 SACK_PERM=1 TSval=2998487 TSecr=0 WS=16
  7.416458 192.168.1.100 -> 192.168.1.1  HTTP 448 GET /images/batt2.gif HTTP/1.1 
  7.417180 192.168.1.100 -> 192.168.1.1  HTTP 457 GET /images/sms_new1_index.gif HTTP/1.1 
  7.417385  192.168.1.1 -> 192.168.1.100 TCP 74 http > 59588 [SYN, ACK] Seq=0 Ack=1 Win=5792 Len=0 MSS=1460 SACK_PERM=1 TSval=185837 TSecr=2998487 WS=2
  7.417485 192.168.1.100 -> 192.168.1.1  TCP 66 59588 > http [ACK] Seq=1 Ack=1 Win=14608 Len=0 TSval=2998488 TSecr=185837
  7.417798 192.168.1.100 -> 192.168.1.1  HTTP 460 GET /images/wan_connect_index.gif HTTP/1.1 
  7.418461 192.168.1.100 -> 192.168.1.1  HTTP 455 GET /images/WIFI_index_2.gif HTTP/1.1 
  7.419052 192.168.1.100 -> 192.168.1.1  HTTP 449 GET /images/level1.gif HTTP/1.1 
  7.419616 192.168.1.100 -> 192.168.1.1  HTTP 459 GET /images/network_3g_index.gif HTTP/1.1 
  7.424362  192.168.1.1 -> 192.168.1.100 TCP 66 http > 59583 [ACK] Seq=1 Ack=383 Win=6864 Len=0 TSval=185838 TSecr=2998488
  7.424483  192.168.1.1 -> 192.168.1.100 TCP 311 [TCP segment of a reassembled PDU]
  7.424542 192.168.1.100 -> 192.168.1.1  TCP 66 59583 > http [ACK] Seq=383 Ack=246 Win=15680 Len=0 TSval=2998490 TSecr=185838
  7.429112  192.168.1.1 -> 192.168.1.100 HTTP 66 HTTP/1.0 200 Ok  (GIF89a) (GIF89a) (image/gif)
  7.429878 192.168.1.100 -> 192.168.1.1  TCP 66 59583 > http [FIN, ACK] Seq=383 Ack=247 Win=15680 Len=0 TSval=2998491 TSecr=185838
  7.430665  192.168.1.1 -> 192.168.1.100 TCP 66 http > 59584 [ACK] Seq=1 Ack=392 Win=6864 Len=0 TSval=185838 TSecr=2998488
  7.430842  192.168.1.1 -> 192.168.1.100 TCP 328 [TCP segment of a reassembled PDU]
  7.430900 192.168.1.100 -> 192.168.1.1  TCP 66 59584 > http [ACK] Seq=392 Ack=263 Win=15680 Len=0 TSval=2998492 TSecr=185838
  7.431007  192.168.1.1 -> 192.168.1.100 HTTP 66 HTTP/1.0 200 Ok  (GIF89a) (GIF89a) (image/gif)
  7.435944 192.168.1.100 -> 192.168.1.1  TCP 74 59589 > http [SYN] Seq=0 Win=14600 Len=0 MSS=1460 SACK_PERM=1 TSval=2998493 TSecr=0 WS=16
  7.436533  192.168.1.1 -> 192.168.1.100 TCP 66 http > 59585 [ACK] Seq=1 Ack=395 Win=6864 Len=0 TSval=185839 TSecr=2998488
  7.436712  192.168.1.1 -> 192.168.1.100 TCP 313 [TCP segment of a reassembled PDU]
  7.436780 192.168.1.100 -> 192.168.1.1  TCP 66 59585 > http [ACK] Seq=395 Ack=248 Win=15680 Len=0 TSval=2998493 TSecr=185839
  7.441354  192.168.1.1 -> 192.168.1.100 HTTP 66 HTTP/1.0 200 Ok  (GIF89a) (GIF89a) (image/gif)
  7.443151 192.168.1.100 -> 192.168.1.1  TCP 66 59584 > http [FIN, ACK] Seq=392 Ack=264 Win=15680 Len=0 TSval=2998495 TSecr=185838
  7.448255  192.168.1.1 -> 192.168.1.100 TCP 66 http > 59586 [ACK] Seq=1 Ack=390 Win=6864 Len=0 TSval=185839 TSecr=2998488
  7.448377  192.168.1.1 -> 192.168.1.100 TCP 355 [TCP segment of a reassembled PDU]
  7.448429 192.168.1.100 -> 192.168.1.1  TCP 66 59586 > http [ACK] Seq=390 Ack=290 Win=15680 Len=0 TSval=2998496 TSecr=185840
  7.453624  192.168.1.1 -> 192.168.1.100 HTTP 66 HTTP/1.0 200 Ok  (GIF89a) (GIF89a) (image/gif)
  7.454786  192.168.1.1 -> 192.168.1.100 TCP 66 http > 59587 [ACK] Seq=1 Ack=384 Win=6864 Len=0 TSval=185840 TSecr=2998489
  7.454930  192.168.1.1 -> 192.168.1.100 TCP 281 [TCP segment of a reassembled PDU]
  7.454988 192.168.1.100 -> 192.168.1.1  TCP 66 59587 > http [ACK] Seq=384 Ack=216 Win=15680 Len=0 TSval=2998498 TSecr=185840
  7.455106  192.168.1.1 -> 192.168.1.100 HTTP 66 HTTP/1.0 200 Ok  (GIF89a) (GIF89a) (image/gif)
  7.455677 192.168.1.100 -> 192.168.1.1  TCP 66 59585 > http [FIN, ACK] Seq=395 Ack=249 Win=15680 Len=0 TSval=2998498 TSecr=185839
  7.456936  192.168.1.1 -> 192.168.1.100 TCP 66 http > 59588 [ACK] Seq=1 Ack=394 Win=6864 Len=0 TSval=185841 TSecr=2998489
  7.457074  192.168.1.1 -> 192.168.1.100 TCP 302 [TCP segment of a reassembled PDU]
  7.457132 192.168.1.100 -> 192.168.1.1  TCP 66 59588 > http [ACK] Seq=394 Ack=237 Win=15680 Len=0 TSval=2998498 TSecr=185841
  7.457525  192.168.1.1 -> 192.168.1.100 HTTP 66 HTTP/1.0 200 Ok  (GIF89a) (GIF89a) (image/gif)
  7.459186  192.168.1.1 -> 192.168.1.100 TCP 66 http > 59583 [ACK] Seq=247 Ack=384 Win=6864 Len=0 TSval=185841 TSecr=2998491
  7.459510  192.168.1.1 -> 192.168.1.100 TCP 74 http > 59589 [SYN, ACK] Seq=0 Ack=1 Win=5792 Len=0 MSS=1460 SACK_PERM=1 TSval=185841 TSecr=2998493 WS=2
  7.459615 192.168.1.100 -> 192.168.1.1  TCP 66 59589 > http [ACK] Seq=1 Ack=1 Win=14608 Len=0 TSval=2998499 TSecr=185841
